{
  "$schema": "https://json-schema.org/draft/2020-12/schema",
  "$id": "https://github.com/os2display/display-templates/blob/develop/build/image-text/image-text-schema.json",
  "title": "image-text schema",
  "description": "Content schema for image-text",
  "type": "object",
  "properties": {
    "image": {
      "description": "@id for the image",
      "type": "string"
    },
    "styling": {
      "type": "object",
      "properties": {
        "halfSize": {
          "description": "TODO: Describe",
          "type": "boolean"
        },
        "shadow": {
          "description": "TODO: Describe",
          "type": "boolean"
        },
        "boxAlign": {
          "description": "TODO: Describe",
          "type": "string"
        },
        "boxMargin": {
          "description": "TODO: Describe",
          "type": "boolean"
        },
        "separator": {
          "description": "TODO: Describe",
          "type": "boolean"
        },
        "reversed": {
          "description": "TODO: Describe",
          "type": "boolean"
        }
      }
    },
    "text": {
      "description": "Text for the slide",
      "type": "string"
    },
    "title": {
      "description": "Title for the slide",
      "type": "string"
    }
  }
}
